{
  "schema_version": "factory-autonomy-memory-pointer/v1",
  "selected_generated_at": "2026-04-05T20:16:05Z",
  "selected_memory_id": "factory-autonomy-memory-20260405t201605z",
  "selected_memory_path": ".pack-state/agent-memory/factory-autonomy-memory-20260405t201605z.json",
  "selected_memory_sha256": "a8f94ea6e48acceef417092d4e1f1d66ea4209586ec2ce84b1543ded9bc65fea",
  "selected_memory_tier": "promoted_factory_memory",
  "source_kind": "factory_memory_refresh",
  "source_tool": "tools/refresh_factory_autonomy_memory.py",
  "updated_at": "2026-04-05T20:16:05Z"
}
